{
  "authority": {
    "accepts_model": false,
    "attests_loaded_bytes": false,
    "authorizes_deployment": false,
    "authorizes_release": false,
    "changes_host": false,
    "contacts_provider": false,
    "grants_action_authority": false,
    "grants_detector_authority": false,
    "pulls_model": false,
    "starts_provider": false
  },
  "binding_status": "UNBOUND",
  "evidence": {
    "binding_sha256": "6ebb5b746edb09845fc9d63fd5688409f049d8471744732fb55510e21ed29287",
    "comparison_boundary_sha256": null,
    "containment_receipt_sha256": null,
    "evaluation_boundary_sha256": null,
    "evaluation_receipt_sha256": null,
    "format_schema_sha256": null,
    "identity_observation_sha256": null,
    "profile_sha256": null,
    "provider_identity_sha256": null,
    "request_sha256": null
  },
  "gate_failures": [
    "OWNER_MODEL_BINDING_NOT_RECORDED"
  ],
  "identifiers": {
    "corpus_id": null,
    "host_profile_id": null,
    "installed_tag": null,
    "logical_alias": null,
    "profile_id": null
  },
  "input_states": {
    "containment": null,
    "evaluation": null,
    "identity": null,
    "profile": null,
    "request": null
  },
  "limitations": [
    "This packet proves cross-record consistency, not evidence origin or execution.",
    "API metadata and supplied digests do not attest bytes loaded during inference.",
    "A consistent packet is not model acceptance, release, deployment, or host authority."
  ],
  "model_advertises_tools": false,
  "packet_sha256": "eaa70bbeba1e121db1ebf4fe1bab15e00b9313d7b5954962aa97eb24c23e331f",
  "remaining_holds": [
    "EVIDENCE_ORIGIN_AUTHENTICATION",
    "LOADED_RUNTIME_BYTES_NOT_ATTESTED",
    "RUNTIME_PROVIDER_WIRING",
    "INDEPENDENT_SECURITY_ACCEPTANCE_CURRENTNESS",
    "OWNER_FINAL_ACCEPTANCE",
    "RELEASE_AND_DEPLOYMENT_AUTHORITY"
  ],
  "schema": "megalodon-local-model-readiness-v1",
  "state": "UNBOUND",
  "tools_used_or_authorized": false
}
